"Title","Description","BiocVersion","Genome","SourceType","SourceUrl","SourceVersion","Species","TaxonomyId","Coordinate_1_based","DataProvider","Maintainer","RDataClass","DispatchClass","Location_Prefix","RDataPath"
"ContextEncoder_Mouse","Context (gene lcpms) encoder of mouse contrast experiments compiled from ARCHS4","3.17","GRCm39","HDF5","https://maayanlab.cloud/archs4/","ARCHS4 v2.1.2","Mus musculus","10090",NA,"Ma'ayan Laboratory (https://labs.icahn.mssm.edu/maayanlab/)","Panagiotis Papasaikas <panagiotis.papasaikas@fmi.ch>","keras.engine.functional.Functional","keras::load_model_hdf5; require keras","","TRAINED_MODELS/ContextEncoder_ARCHS4_v212_Mouse"
"ContextEncoder_Human","Context (gene lcpms) encoder of human contrast experiments compiled from ARCHS4","3.17","GRCh38","HDF5","https://maayanlab.cloud/archs4/","ARCHS4 v2.1.2","Homo sapiens","9606",NA,"Ma'ayan Laboratory (https://labs.icahn.mssm.edu/maayanlab/)","Panagiotis Papasaikas <panagiotis.papasaikas@fmi.ch>","keras.engine.functional.Functional","keras::load_model_hdf5; require keras","","TRAINED_MODELS/ContextEncoder_ARCHS4_v212_Mouse"
"DeltaEncoder_Mouse","Contrast (gene lcpm deltas i.e LFCs) encoder of mouse contrast experiments compiled from ARCHS4","3.17","GRCm39","HDF5","https://maayanlab.cloud/archs4/","ARCHS4 v2.1.2","Mus musculus","10090",NA,"Ma'ayan Laboratory (https://labs.icahn.mssm.edu/maayanlab/)","Panagiotis Papasaikas <panagiotis.papasaikas@fmi.ch>","keras.engine.functional.Functional","keras::load_model_hdf5; require keras","","TRAINED_MODELS/DeltaEncoder_FT_ARCHS4_v212_Mouse"
"DeltaEncoder_Human","Contrast (gene lcpm deltas i.e LFCs) encoder of human contrast experiments compiled from ARCHS4","3.17","GRCh38","HDF5","https://maayanlab.cloud/archs4/","ARCHS4 v2.1.2","Homo sapiens","9606",NA,"Ma'ayan Laboratory (https://labs.icahn.mssm.edu/maayanlab/)","Panagiotis Papasaikas <panagiotis.papasaikas@fmi.ch>","keras.engine.functional.Functional","keras::load_model_hdf5; require keras","","TRAINED_MODELS/DeltaEncoder_FT_ARCHS4_v212_Human"
"DeltaDecoder_Mouse","Contrast (gene lcpm deltas i.e LFCs) decoder of mouse contrast experiments compiled from ARCHS4","3.17","GRCm39","HDF5","https://maayanlab.cloud/archs4/","ARCHS4 v2.1.2","Mus musculus","10090",NA,"Ma'ayan Laboratory (https://labs.icahn.mssm.edu/maayanlab/)","Panagiotis Papasaikas <panagiotis.papasaikas@fmi.ch>","keras.engine.functional.Functional","keras::load_model_hdf5; require keras","","TRAINED_MODELS/DeltaDecoder_FT_ARCHS4_v212_Mouse"
"DeltaDecoder_Human","Contrast (gene lcpm deltas i.e LFCs) decoder of human contrast experiments compiled from ARCHS4","3.17","GRCh38","HDF5","https://maayanlab.cloud/archs4/","ARCHS4 v2.1.2","Homo sapiens","9606",NA,"Ma'ayan Laboratory (https://labs.icahn.mssm.edu/maayanlab/)","Panagiotis Papasaikas <panagiotis.papasaikas@fmi.ch>","keras.engine.functional.Functional","keras::load_model_hdf5; require keras","","TRAINED_MODELS/DeltaDecoder_FT_ARCHS4_v212_Human"
"decomposed_contrasts_mouse","HDF5-based SummarizedExperiment with full and decomposed mouse contrast experiments compiled from ARCHS4 and associated metadata","3.17","GRCm39","tar","https://maayanlab.cloud/archs4/","ARCHS4 v2.1.2","Mus musculus","10090",NA,"Ma'ayan Laboratory (https://labs.icahn.mssm.edu/maayanlab/)","Panagiotis Papasaikas <panagiotis.papasaikas@fmi.ch>","keras.engine.functional.Functional","HDF5Array::loadHDF5SummarizedExperiment; require HDF5Array","","DECOMPOSED_CONTRASTS/mouse_v212_c100se.tar"
"decomposed_contrasts_human","HDF5-based SummarizedExperiment with full and decomposed human contrast experiments compiled from ARCHS4 and associated metadata","3.17","GRCh38","tar","https://maayanlab.cloud/archs4/","ARCHS4 v2.1.2","Homo sapiens","9606",NA,"Ma'ayan Laboratory (https://labs.icahn.mssm.edu/maayanlab/)","Panagiotis Papasaikas <panagiotis.papasaikas@fmi.ch>","keras.engine.functional.Functional","HDF5Array::loadHDF5SummarizedExperiment; require HDF5Array","","DECOMPOSED_CONTRASTS/human_v212_c100se.tar"
